{
  "$schema":"https://json-schema.org/draft/2020-12/schema","type":"object","additionalProperties":false,
  "required":["schemaVersion","planId","targetPbi","mutationDomain","decisionState","executionStatus","storeLevelRiskAcknowledged","currentReadSnapshot","deterministicInput","fieldAllowlist","dryRun","approvals","beforeState","rollback","partialFailureRecovery","idempotency","graphqlErrorHandling","throttlingAndResume","afterSnapshot","driftValidation","existingAdminChangeRecord","productionThemeMutationAuthorized"],
  "properties":{"$schema":{"type":"string"},"schemaVersion":{"const":1},"planId":{"type":"string","pattern":"^E-MUT-[0-9]{3}$"},"targetPbi":{"type":"string","pattern":"^E-PBI-02[0-3][A-Z]?$"},"mutationDomain":{"type":"string","pattern":"^[a-z0-9_]+$"},"decisionState":{"enum":["observed","proposed","approved","conflicting","blocked","deprecated","superseded"]},"executionStatus":{"enum":["template","blocked","approved","completed","partially_failed","rolled_back"]},"storeLevelRiskAcknowledged":{"const":true},"currentReadSnapshot":{"$ref":"#/$defs/artifact"},"deterministicInput":{"$ref":"#/$defs/artifact"},"fieldAllowlist":{"type":"array","minItems":1,"items":{"type":"string","minLength":2}},"dryRun":{"type":"object","additionalProperties":false,"required":["command","artifact","status"],"properties":{"command":{"type":"string","minLength":3},"artifact":{"$ref":"#/$defs/artifact"},"status":{"enum":["not_run","passed","failed"]}}},"approvals":{"type":"array","minItems":2,"items":{"type":"object","additionalProperties":false,"required":["role","granted","recordedAt","evidence"],"properties":{"role":{"enum":["Product Owner","Shopify Admin Owner"]},"granted":{"type":"boolean"},"recordedAt":{"type":["string","null"]},"evidence":{"type":["string","null"]}}}},"beforeState":{"$ref":"#/$defs/artifact"},"rollback":{"type":"object","additionalProperties":false,"required":["classification","procedure","preservesIdsAndReferences","artifact"],"properties":{"classification":{"enum":["fully_reversible","compensating_mutation","partially_reversible","irreversible"]},"procedure":{"type":"string","minLength":20},"preservesIdsAndReferences":{"type":"boolean"},"artifact":{"$ref":"#/$defs/artifact"}}},"partialFailureRecovery":{"type":"string","minLength":20},"idempotency":{"type":"string","minLength":20},"graphqlErrorHandling":{"type":"object","additionalProperties":false,"required":["transportErrors","graphqlErrors","userErrors"],"properties":{"transportErrors":{"type":"string","minLength":10},"graphqlErrors":{"type":"string","minLength":10},"userErrors":{"type":"string","minLength":10}}},"throttlingAndResume":{"type":"string","minLength":20},"afterSnapshot":{"$ref":"#/$defs/artifact"},"driftValidation":{"type":"object","additionalProperties":false,"required":["command","expectedArtifact","status"],"properties":{"command":{"type":"string","minLength":3},"expectedArtifact":{"$ref":"#/$defs/artifact"},"status":{"enum":["not_run","passed","failed"]}}},"existingAdminChangeRecord":{"type":"string","minLength":3},"productionThemeMutationAuthorized":{"const":false}},
  "$defs":{"artifact":{"type":"object","additionalProperties":false,"required":["path","sha256","requiredBeforeExecution"],"properties":{"path":{"type":"string","minLength":1},"sha256":{"type":["string","null"],"pattern":"^[a-f0-9]{64}$"},"requiredBeforeExecution":{"type":"boolean"}}}}
}
